{
  "schemaVersion": "0.2",
  "executionId": "8f3b1479-7a0e-4364-969c-29b3a0f7cda1",
  "organizationId": "50dd02a1-5d07-4e08-98e3-05ecbc8eef1b",
  "monitorId": "c9a09156-f5fa-4cf7-9a09-775b11158567",
  "monitorVersion": 1,
  "probeId": "dev-ap-southeast-1",
  "region": "ap-southeast-1",
  "startedAt": "2026-09-08T08:00:01Z",
  "completedAt": "2026-09-08T08:00:01.045Z",
  "durationMs": 45,
  "outcome": "PASS",
  "tcp": {
    "connected": true
  }
}
