{
  "schemaVersion": "0.1",
  "executionId": "11111111-1111-4111-8111-111111111111",
  "organizationId": "22222222-2222-4222-8222-222222222222",
  "monitorId": "33333333-3333-4333-8333-333333333333",
  "monitorVersion": 1,
  "probeId": "local-probe",
  "region": "local",
  "startedAt": "2026-09-04T00:00:00Z",
  "completedAt": "2026-09-04T00:00:00.025Z",
  "durationMs": 25,
  "outcome": "PASS",
  "http": {
    "statusCode": 200,
    "responseBytes": 15
  }
}
