{
  "schemaVersion": "0.2",
  "executionId": "9b12271a-200a-4a25-9781-a83a31c19b02",
  "organizationId": "50dd02a1-5d07-4e08-98e3-05ecbc8eef1b",
  "monitorId": "d32512f4-7502-4ec4-9cb3-cb0973e721ea",
  "monitorVersion": 1,
  "probeId": "dev-ap-northeast-1",
  "region": "ap-northeast-1",
  "startedAt": "2026-09-08T08:00:01Z",
  "completedAt": "2026-09-08T08:00:01.120Z",
  "durationMs": 120,
  "outcome": "PASS",
  "ssl": {
    "expiresAt": "2027-01-15T12:00:00Z",
    "daysRemaining": 129
  }
}
